Title,URL,Date
BPPE Approval and Outcomes Numbers,https://www.rithmschool.com/blog/bppe-approval-and-outcomes-numbers,2018-07-25
Behind The Scenes: Our Partner Network,https://www.rithmschool.com/blog/partner-network,2018-07-19
What’s New in Python 3.7: Data Classes,https://www.rithmschool.com/blog/whats-new-in-python-3-7,2018-07-11
Five Tips for Getting Yourself Unstuck,https://www.rithmschool.com/blog/five-tips-for-getting-yourself-unstuck,2018-06-22
A Roadmap for Learning How To Code - Part 3,https://www.rithmschool.com/blog/roadmap-for-learning-how-to-code-03,2018-06-13
Student Interview: Paula + Miranda on Company Projects,https://www.rithmschool.com/blog/student-interview-paula-miranda,2018-06-05
Five Essential Rules when Job Searching,https://www.rithmschool.com/blog/five-essential-rules-when-job-searching,2018-05-31
Outcomes: A Preview,https://www.rithmschool.com/blog/outcomes-a-preview,2018-05-22
The Benefit of Low-Abstraction Frameworks for Scaffolding Learning,https://www.rithmschool.com/blog/low-abstraction-frameworks,2018-05-16
Are Coding Schools Worth the Cost?,https://www.rithmschool.com/blog/are-coding-schools-worth-the-cost,2018-04-25
